<?xml version="1.0" encoding="utf-8"?>
<hipertext xmlns:xsi="http://www.w3.org/2001/XMLSchema-instance"
   xsi:noNamespaceSchemaLocation="HH.xsd">
	<author>
		<name>Piotr</name>
		<surname>Trybisz</surname>
	</author>
	<definition>
		Hipertext is a nonlinear text material.
	</definition>
	<systems>
		<system>
			<name>HyperCard</name>
			<description>
				HyperCard was a powerful, yet extremely easy to use tool for creating “stacks” — essentially flat-file databases that used hyperlinks as a way of navigating a stack of “cards”.
			</description>
		</system>
		<system>
			<name>World Wide Web</name>
			<description>
				The World Wide Web is a collection of linked resources and documents, connected by hyperlinks and URLs
			</description>
		</system>
	</systems>
</hipertext>