<?xml version="1.0" encoding="utf-8"?>
<hipertext xmlns:xsi="http://www.w3.org/2001/XMLSchema-instance"
   xsi:noNamespaceSchemaLocation="HH.xsd">
	<author>
		<name>student's name</name>
		<surname>student's surname </surname>
	</author>
	<definition>
		Hipertext is a nonlinear text material.
	</definition>
	<systems>
		<system>
			<name>HyperCard</name>
			<description>
				HyperCard was a powerful, yet extremely easy to use tool for creating “stacks” — essentially flat-file databases that used hyperlinks as a way of navigating a stack of “cards”.
			</description>
			<image source="hypercard.jpg">HyperCard system</image>
			<link source="https://hypercard.org/">HyperCard</link>
			<link source="https://www.youtube.com/watch?v=2K1C5BZKP3I">Why HyperCard was so f***ing Great!</link>
			<link source="https://eshop.macsales.com/blog/64930-hypercard-one-stack-at-a-time/">HyperCard</link>
		</system>
		<system>
			<name>World Wide Web</name>
			<description>
				The World Wide Web is a collection of linked resources and documents, connected by hyperlinks and URLs
			</description>
			<link source="https://www.w3schools.com/html/">HTML w3schools</link>
		</system>
	</systems>
</hipertext>